{
  "product_name": "AI-Generated Legal Contract Templates",
  "core_feature_set": [
    "AI-powered contract template generation",
    "User feedback collection and analysis",
    "Waitlist management and notification system"
  ],
  "target_platforms": [
    "Direct Web"
  ],
  "worker_assignments": {
    "Worker_CPO": {
      "task_description": "Lead the validation sprint and oversee the development of the AI-generated legal contract template solution",
      "required_output_format": "JSON",
      "context_payload": {
        "priority_level": "CRITICAL",
        "strategic_objective": "Validate the market demand for AI-generated legal contract templates and develop a zero-cost solution",
        "kpi_target": "Achieve a 20% conversion rate of users signing up for the waitlist and gather feedback from at least 50 small business owners and freelancers"
      }
    },
    "Worker_CMO": {
      "task_description": "Develop a marketing strategy to promote the waitlist and gather feedback from users",
      "required_output_format": "Marketing Plan Document",
      "context_payload": {
        "target_audience": "Small business owners and freelancers",
        "promotion_channels": "Social media, email marketing, and online advertising"
      }
    },
    "Worker_CTO": {
      "task_description": "Explore the technical feasibility of integrating open-source AI models and free hosting solutions",
      "required_output_format": "Technical Feasibility Report",
      "context_payload": {
        "technical_requirements": "Open-source AI models, free hosting solutions, and zero-cost infrastructure"
      }
    },
    "Worker_COO": {
      "task_description": "Ensure the solution aligns with the company's zero-cost infrastructure mandate and monitor progress",
      "required_output_format": "Progress Report",
      "context_payload": {
        "infrastructure_constraints": "Zero-cost infrastructure",
        "progress_metrics": "Development timeline, budget, and resource allocation"
      }
    }
  }
}